{
  "id": "world.atlas",
  "startingMapResourceId": "map.round-01-grid",
  "regions": [
    {
      "mapResourceId": "map.round-01-grid",
      "name": "江南道·七镇行旅",
      "description": "道路穿过林泽、渡口与两处聚落，行旅可在百格山河间自由往来。",
      "atlasPosition": { "x": 42, "y": 50 }
    },
    {
      "mapResourceId": "map.round-10-mist-ferry",
      "name": "雾雨渡口",
      "description": "山雨与江雾相接，渡船歇在芦苇深处。",
      "atlasPosition": { "x": 85, "y": 80 }
    }
  ],
  "landmarks": [
    { "id": "landmark.northwest-settlement", "mapResourceId": "map.round-01-grid", "col": 23, "row": 27, "name": "西北聚落", "category": "settlement" },
    { "id": "landmark.village-lake", "mapResourceId": "map.round-01-grid", "col": 38, "row": 27, "name": "村北湖泊", "category": "water" },
    { "id": "landmark.eastern-pond", "mapResourceId": "map.round-01-grid", "col": 80, "row": 25, "name": "东野池塘", "category": "water" },
    { "id": "landmark.south-hamlet", "mapResourceId": "map.round-01-grid", "col": 70, "row": 75, "name": "南麓聚落", "category": "settlement" },
    { "id": "landmark.stone-stairs-ferry", "mapResourceId": "map.round-01-grid", "col": 90, "row": 50, "name": "石阶渡口", "category": "crossing" },
    { "id": "landmark.reedbank-landing", "mapResourceId": "map.round-10-mist-ferry", "col": 1, "row": 4, "name": "芦岸登船点", "category": "crossing" }
  ],
  "transitions": [
    {
      "id": "gate.trial-to-ferry",
      "name": "石阶渡口",
      "from": { "mapResourceId": "map.round-01-grid", "col": 90, "row": 50 },
      "to": { "mapResourceId": "map.round-10-mist-ferry", "col": 1, "row": 4 }
    },
    {
      "id": "gate.ferry-to-trial",
      "name": "回望石阶",
      "from": { "mapResourceId": "map.round-10-mist-ferry", "col": 2, "row": 4 },
      "to": { "mapResourceId": "map.round-01-grid", "col": 89, "row": 50 }
    }
  ],
  "events": [
    {
      "id": "event.ferry-first-arrival",
      "mapResourceId": "map.round-10-mist-ferry",
      "col": 1,
      "row": 4,
      "text": "渡口边留着一行新鲜脚印，雨水还没有将它们冲散。",
      "once": true,
      "discoverKnowledgeNodeId": "event.old-footprints"
    },
    {
      "id": "event.trial-cloudbreak",
      "mapResourceId": "map.round-01-grid",
      "col": 43,
      "row": 36,
      "text": "云隙投下一束日光，石面上的旧刻痕清晰起来。",
      "once": true
    },
    {
      "id": "event.reedbank-traces",
      "mapResourceId": "map.round-10-mist-ferry",
      "col": 5,
      "row": 4,
      "text": "沿着脚印走到芦苇边，泥面下露出一截被水草缠住的旧桩。渡船人认得那是废船道留下的系缆桩。",
      "once": true,
      "conditions": {
        "knowledgeNodeIds": ["event.old-footprints"],
        "periodIds": ["period.dusk", "period.night"],
        "weatherIds": ["weather.drizzle", "weather.rain", "weather.storm"]
      },
      "discoverKnowledgeNodeId": "place.reedbank"
    }
  ],
  "randomEvents": [
    {
      "id": "event.r43-wayfarer-letter",
      "mapResourceId": "map.round-10-mist-ferry",
      "text": "黄昏雨脚里，一个赶路人将五封各带不同门派暗记的求助信交给你。他说五派都在寻一双走过芦苇岸的脚，愿你代为核问；信上没有署名。",
      "once": true,
      "chance": 0.12,
      "conditions": {
        "knowledgeNodeIds": ["event.old-footprints"],
        "periodIds": ["period.dusk", "period.night"],
        "weatherIds": ["weather.drizzle", "weather.rain", "weather.storm"]
      },
      "discoverKnowledgeNodeId": "event.r43-wayfarer-letter"
    },
    {
      "id": "event.r44-dock-claim",
      "mapResourceId": "map.round-10-mist-ferry",
      "text": "黄昏雨雾间，石北与白鹭洲正为一根旧系缆桩争执：一人要先打铁楔，一人要先核对渡簿中的船期。两人都不肯让这一步，却都没有急着定谁对谁错。",
      "once": true,
      "chance": 0.35,
      "conditions": {
        "knowledgeNodeIds": ["event.r43-wayfarer-letter"],
        "periodIds": ["period.dusk"],
        "weatherIds": ["weather.drizzle", "weather.rain", "weather.storm"],
        "nearbyNpcIds": ["char.shi-bei", "char.bai-luzhou"]
      },
      "discoverKnowledgeNodeId": "event.r44-dock-claim"
    }
  ]
}
